{
    "<page title>": "ELO 1000 Series 1515L Touch Screen Monitor IGRMV21394 | eBay",
    "additional mpn": "E611558",
    "analog video input connector": "1 x 15 Pin D-Sub connector",
    "aspect ratio": "4:3",
    "brand": "Elo",
    "brightness": "250 cd/m\u00c2\u00b2",
    "color support": "16.2M Colors, 24-bit (16.7M Colors)",
    "color supported": "16.2 Million Colors",
    "condition": "New: A brand-new, unused, unopened, undamaged item in its original packaging (where packaging is\napplicable). Packaging should be the same as what is found in a retail store, unless the item is handmade or was packaged by the manufacturer in non-retail packaging, such as an unprinted box or plastic bag. See the seller's listing for full details.\nSee all condition definitions- opens in a new window or tab\n... Read moreabout the condition\nBrand:\nElo",
    "contrast ratio": "500",
    "display technology": "LCD, Touch Screen, Touch Screen LCD, Touch Screen LCD Touch Screen LCD, Touch Screen LCD Touch Screen LCD Touch Screen LCD LCD Touch Screen",
    "form factor": "Desktop",
    "green compliance certificateauthority": "China RoHS",
    "green compliant": "Yes",
    "input device": "Touch Screen",
    "limited warranty": "3 Year",
    "max viewing angle horizontal": "120\u00c2\u00b0",
    "max viewing angle vertical": "100\u00c2\u00b0",
    "max. resolution": "1024 x 768",
    "maximum resolution": "1024 x 768",
    "mfg model": "IGRMV21394",
    "model": "IntelliTouch 1515L",
    "monitor color": "Gray",
    "monitor platform source": "PC, Mac",
    "mount type": "Desk Mountable",
    "mpn": "E700813",
    "product family": "1000",
    "product information": "The 15-inch gray Elo Touch IntelliTouch 1515L offers a native resolution of 1024 x 768 at 75 Hz with 16.7 million colors. This Elo Touch touchmonitor offers a contrast ratio of 500:1 and an aspect ratio of 4:3. The IntelliTouch Surface Wave Technology-powered glass surface on this Elo Touch LCD monitor is resilient against spilled food, grease, and liquids. Choose from among Acoustic Pulse Recognition Technology, IntelliTouch Surface Wave Technology, and AccuTouch Five-Wire Resistive Technology on your Elo Touch IntelliTouch 1515L. This Elo Touch LCD monitor delivers cost-effective touch tools for sectors like retail and hospitality. You can opt for 3-track magnetic stripe reader (credit card reader), which can be easily installed on this Elo Touch touchmonitor, to deliver a reliable, efficient and smart computing system. The wall-mountable Elo Touch IntelliTouch 1515L is network-compatible and is provided with RS-232 and USB interfaces, for easy connectivity to any POS.\nProduct Identifiers BrandElo ModelIntelliTouch 1515L UPC0411493005510, 0741149300551, 683728214227, 7411493005510, 741149300568, 741149300575, 7411493005756, 876706000008 Additional MPNE611558\nKey Features Product LineElo Touch Display TechnologyLCD, Touch Screen, Touch Screen LCD, Touch Screen LCD Touch Screen LCD, Touch Screen LCD Touch Screen LCD Touch Screen LCD LCD Touch Screen Screen Size15\" Maximum Resolution1024 x 768 Aspect Ratio4:3 Contrast Ratio500:1 Response Time21.5 ms Refresh Rate75 Hz\nTechnical Features Synchronization Range - Vertical56.3 - 75 kHz Synchronization Range - Horizontal31.5 - 60.2 kHz Max Viewing Angle Horizontal120\u00c2\u00b0 Max Viewing Angle Vertical100\u00c2\u00b0 Regulatory ApprovalC-TICK, CE, FCC, IC, TUV-GS, UL, VCCI, cUL Color Support16.2M Colors, 24-bit (16.7M Colors) Form FactorDesktop\nConnectivity Input DeviceTouch Screen Analog Video Input Connector1 x 15 Pin D-Sub connector\nMiscellaneous Monitor ColorGray Monitor Platform SourcePC, Mac",
    "product line": "Elo Touch",
    "product type": "LCD Touchscreen Monitor",
    "refresh rate": "75 Hz",
    "regulatory approval": "C-TICK, CE, FCC, IC, TUV-GS, UL, VCCI, cUL",
    "response time": "21.5 ms",
    "screen size": "15\"",
    "synchronization range  horizontal": "31.5 - 60.2 kHz",
    "synchronization range  vertical": "56.3 - 75 kHz",
    "system": "Desktop",
    "touchscreen": "Yes",
    "touchscreen type": "Surface Acoustic Wave",
    "unit of measure": "EA",
    "upc": "0411493005510, 0741149300551, 683728214227, 7411493005510, 741149300568, 741149300575, 7411493005756, 876706000008"
}