{
    "<page title>": "Acer B276HUL 27\" LED LCD Monitor 16 9 6 MS UM HB6AA A01 2560x1440 B276HUL | eBay",
    "aspect ratio": "16:9",
    "brand": "Acer",
    "brightness": "350 Nit",
    "condition": "New: A brand-new, unused, unopened, undamaged item in its original packaging (where packaging is\napplicable). Packaging should be the same as what is found in a retail store, unless the item is handmade or was packaged by the manufacturer in non-retail packaging, such as an unprinted box or plastic bag. See the seller's listing for full details.\nSee all condition definitions- opens in a new window or tab\n... Read moreabout the condition",
    "contrast ratio": "100,000,000:1",
    "display technology": "LCD",
    "main features": "Manufacturer/Supplier: Acer, Inc\nManufacturer Part Number: UM.HB6AA.A01\nManufacturer Website Address: http://us.acer.com\nBrand Name: Acer\nProduct Series: B\nProduct Model: B276HUL\nProduct Name: B276HUL Widescreen LCD Monitor\nProduct Type: LCD Monitor\nNumber of Screens: 1\nScreen Size: 27\"\nScreen Mode: WQHD\nResponse Time: 6 ms\nAspect Ratio: 16:9\nHorizontal Viewing Angle: 178\u00c2\u00b0\nVertical Viewing Angle: 178\u00c2\u00b0\nAdjustable Display Angle: Yes\nAdjustable Display Height: Yes\nAdjustable Display Pivot: Yes\nBacklight Technology: LED\nMaximum Resolution: 2560 x 1440\nStandard Refresh Rate: 60 Hz\nColor Supported: 16.7 Million Colors\nContrast Ratio: 100,000,000:1\nBrightness: 350 Nit\nSpeakers: Yes\nDVI: Yes\nHDMI: Yes\nUSB: Yes\nDisplayPort: Yes\nBuilt-in Devices: USB Hub\nInput Voltage: 110 V AC, 220 V AC\nOperating Power Consumption: 32.80 W\nStandby Power Consumption: 490 mW\nOff-Mode Power Consumption: 350 mW\nColor: Dark Gray\nHeight: 15\"\nWidth: 25.2\"\nDepth: 2.4\"\nHeight with Stand: 21.97\"\nWidth with Stand: 25.20\"\nDepth with Stand: 9.72\"\nWeight (Approximate): 13.23 lb\nWeight with Stand (Approximate): 18.76 lb\nPackage Contents: B276HUL Widescreen LCD Monitor, 1 x DVI Cable, 1 x DisplayPort Cable, 1 x HDMI Cable, 1 x USB 3.0 Cable, Power Cord\nGreen Compliant: Yes\nGreen Compliance Certificate/Authority: EPEAT Gold, TCO Certified Displays 6.0 General Information\nManufacturer/Supplier:\nAcer, Inc\nManufacturer Part Number:\nUM.HB6AA.A01\nManufacturer Website Address:\nhttp://us.acer.com\nBrand Name:\nAcer\nProduct Series:\nB\nProduct Model:\nB276HUL\nProduct Name:\nB276HUL Widescreen LCD Monitor\nProduct Type:\nLCD Monitor Technical Information\nNumber of Screens:\n1\nScreen Size:\n27\"\nScreen Mode:\nWQHD\nScreen Surface:\nAnti-glare\nPanel Technology:\nAdvanced Hyper Viewing Angle (AHVA)\nResponse Time:\n6 ms\nAspect Ratio:\n16:9\nHorizontal Viewing Angle:\n178\u00c2\u00b0\nVertical Viewing Angle:\n178\u00c2\u00b0\nAdjustable Display Angle:\nYes\nAdjustable Display Height:\nYes\nAdjustable Display Pivot:\nYes\nBacklight Technology:\nLED Video\nMaximum Resolution:\n2560 x 1440\nStandard Refresh Rate:\n60 Hz\nColor Supported:\n16.7 Million Colors\nContrast Ratio:\n100,000,000:1\nBrightness:\n350 Nit Audio\nSpeakers:\nYes Interfaces/Ports\nDVI:\nYes\nHDMI:\nYes\nUSB:\nYes\nUSB Standard:\nUSB 3.0\nDisplayPort:\nYes Built-in Devices\nBuilt-in Devices:\nUSB Hub Power Description\nInput Voltage:\n110 V AC\n220 V AC\nOperating Power Consumption:\n32.80 W\nStandby Power Consumption:\n490 mW\nOff-Mode Power Consumption:\n350 mW Physical Characteristics\nColor:\nDark Gray\nHeight:\n15\"\nWidth:\n25.2\"\nDepth:\n2.4\"\nHeight with Stand:\n21.97\"\nWidth with Stand:\n25.20\"\nDepth with Stand:\n9.72\"\nWeight (Approximate):\n13.23 lb\nWeight with Stand (Approximate):\n18.76 lb Shipping Information\nShipping Dimensions :\n7.9\" Height x 20.1\" Width x 27.6\" Depth\nShipping Weight :\n21.45 lb Miscellaneous\nPackage Contents:\nB276HUL Widescreen LCD Monitor\n1 x DVI Cable\n1 x DisplayPort Cable\n1 x HDMI Cable\n1 x USB 3.0 Cable\nPower Cord\nGreen Compliant:\nYes\nGreen Compliance Certificate/Authority:\nEPEAT Gold\nTCO Certified Displays 6.0",
    "max resolution": "2560 x 1440",
    "model": "UM.HB6AA.A01",
    "mpn": "UM.HB6AA.A01",
    "response time": "6 ms",
    "screen size": "27\"",
    "system": "Desktop",
    "video inputs": "DVI-I"
}