{
    "<page title>": "Dell E176FP 17\" LCD Flat Screen Monitor with VGA and Power Cables Plus EXTRAS 890552627257 | eBay",
    "additional mpn": "T9998",
    "analog video input connector": "1 x 15 Pin D-Sub connector",
    "aspect ratio": "5:4",
    "brand": "Dell",
    "brightness": "300 cd/m\u00c2\u00b2",
    "color support": "24-bit (16.7M Colors)",
    "condition": "Used: An item that has been used previously. The item may have some signs of cosmetic wear, but is fully\noperational and functions as intended. This item may be a floor model or store return that has been used. See the seller\u00e2\u0080\u0099s listing for full details and description of any imperfections.\nSee all condition definitions- opens in a new window or tab\n... Read moreabout the condition\nBrand:\nDell",
    "contrast ratio": "450",
    "display technology": "LCD",
    "form factor": "Desktop",
    "max viewing angle horizontal": "140\u00c2\u00b0",
    "max viewing angle vertical": "120\u00c2\u00b0",
    "max. resolution": "1280 x 1024",
    "maximum resolution": "1280 x 1024",
    "model": "E176FP",
    "monitor color": "Gray",
    "monitor platform source": "PC",
    "mpn": "T9998",
    "product information": "Get superior picture quality with the Dell E176FP LCD monitor. The 450:1 contrast ratio of this Dell 17-inch monitor enhances the black and the white levels for a stunning picture performance. With a 12 ms response time, this Dell LCD monitor reduces the ghosting and delivers blur-free images. Shielded with antiglare and hard-coating 3H, the Dell E176FP monitor offers light reflection-free images. The 120\u00c2\u00b0vertical and 140\u00c2\u00b0 horizontal viewing angle of this Dell 17-inch monitor makes every seat in the room the best one for viewing the screen. The 300 cd/m \u00c2\u00b2 brightness level of this Dell LCD monitor produces bright, vivid and lively images.\nProduct Identifiers BrandDell ModelE176FP UPC890552627257 Additional MPNT9998\nKey Features Product LineDell UltraSharp Display TechnologyFlat Panel LCD TFT (Active Matrix), LCD Screen Size17\" Maximum Resolution1280 x 1024 Aspect Ratio5:4 Contrast Ratio450:1 Response Time12 ms Refresh Rate76 Hz\nTechnical Features Synchronization Range - Vertical56 - 76 kHz Synchronization Range - Horizontal31 - 81 kHz Max Viewing Angle Horizontal140\u00c2\u00b0 Max Viewing Angle Vertical120\u00c2\u00b0 Color Support24-bit (16.7M Colors) Form FactorDesktop\nConnectivity Analog Video Input Connector1 x 15 Pin D-Sub connector\nMiscellaneous Monitor ColorGray Monitor Platform SourcePC",
    "product line": "Dell UltraSharp",
    "refresh rate": "76 Hz",
    "response time": "12 ms",
    "screen size": "17\"",
    "synchronization range  horizontal": "31 - 81 kHz",
    "synchronization range  vertical": "56 - 76 kHz",
    "system": "Desktop",
    "upc": "890552627257"
}