{
    "<page title>": "Samsung SyncMaster 2243BWX 22\" Widescreen LCD Monitor 1000 1 16 10 5 MS 729507803562 | eBay",
    "additional mpn": "2243BWT1, 2243BWTTAA, LS22MYKEBQ/XSA",
    "analog video input connector": "1 x 15 Pin D-Sub connector",
    "aspect ratio": "16:10",
    "brand": "Samsung",
    "brightness": "300 cd/m\u00c2\u00b2",
    "color support": "24-bit (16.7M Colors)",
    "condition": "Used: An item that has been used previously. The item may have some signs of cosmetic wear, but is fully\noperational and functions as intended. This item may be a floor model or store return that has been used. See the seller\u00e2\u0080\u0099s listing for full details and description of any imperfections.\nSee all condition definitions- opens in a new window or tab\n... Read moreabout the condition\nBrand:\nSamsung",
    "contrast ratio": "1000:1",
    "digital video input standard": "DVI-D",
    "display technology": "LCD, Widescreen LCD, Widescreen LCD Widescreen TFT LCD, Widescreen TFT",
    "form factor": "Desktop",
    "input device": "Camera",
    "max viewing angle horizontal": "170\u00c2\u00b0",
    "max viewing angle vertical": "160\u00c2\u00b0",
    "model": "2243BWX",
    "monitor color": "Black",
    "mpn": "LS22MYKEBQ/XSA",
    "product information": "The affordable 2243BW offers a space-saving design with all the features you need. Make sure you\u00e2\u0080\u0099re in the best position to do your finest work with the height adjustable stand (HAS). Whether you\u00e2\u0080\u0099re watching a movie or designing a presentation, the 8,000:1 Dynamic Contrast Ratio ensures superior quality, easy-to-view images. Complete with Microsoft Vista Premium certification, the 2243BW is ideal for demanding users.\nProduct Identifiers BrandSamsung Model2243BWX UPC729507803562, 8808987588083 Additional MPN2243BWT1, 2243BWTTAA, LS22MYKEBQ/XSA\nKey Features Product LineSamsung SyncMaster Display TechnologyLCD, Widescreen LCD, Widescreen LCD Widescreen TFT LCD, Widescreen TFT Screen Size22\" Aspect Ratio16:10 Contrast Ratio1000:1 Response Time5 ms Refresh Rate75 Hz\nTechnical Features Synchronization Range - Vertical56 - 75 kHz Synchronization Range - Horizontal30 - 81 kHz Max Viewing Angle Horizontal170\u00c2\u00b0 Max Viewing Angle Vertical160\u00c2\u00b0 Regulatory ApprovalEMC, Energy star, TCO-03 Color Support24-bit (16.7M Colors) Form FactorDesktop\nConnectivity Input DeviceCamera Analog Video Input Connector1 x 15 Pin D-Sub connector Digital Video Input StandardDVI-D\nMiscellaneous Monitor ColorBlack",
    "product line": "Samsung SyncMaster",
    "refresh rate": "75 Hz",
    "regulatory approval": "EMC, Energy star, TCO-03",
    "response time": "5 ms",
    "screen size": "22\"",
    "synchronization range  horizontal": "30 - 81 kHz",
    "synchronization range  vertical": "56 - 75 kHz",
    "system": "Desktop",
    "upc": "729507803562, 8808987588083",
    "video inputs": "DVI-D"
}