{
    "<page title>": "ELO Touch 1537L 15\" LCD Monitor 074114931826 | eBay",
    "additional mpn": "E194933, F76514-000",
    "analog video input connector": "1 x 15 Pin D-Sub connector",
    "aspect ratio": "4:3",
    "brand": "Elo",
    "color support": "24-bit (16.7M Colors)",
    "contrast ratio": "500:1",
    "display technology": "LCD, TFT",
    "form factor": "Integrated",
    "input device": "Touch Screen",
    "max resolution": "1024 x 768",
    "max viewing angle horizontal": "120\u00c2\u00b0",
    "max viewing angle vertical": "100\u00c2\u00b0",
    "maximum resolution": "1024 x 768",
    "model": "1537L",
    "monitor color": "Gray",
    "mpn": "E194933",
    "product information": "Get the AccuTouch 1537L LCD monitor and enjoy the touchscreen benefit, which is incorporated with a watertight 0.5 mm seal mini bezel that enhances its look. The 15-inch widescreen display of this Tyco Electronics touch monitor gives a native resolution of 1024x768 pixels that offer exceptional picture quality and clearer moving images. This Tyco Electronics 15-inch monitor features 3mm SecureTouch glass touch sensor, which is chemically strengthened for regular usage. The AccuTouch 1537L is sleek and compact with thin borders, while the multiple mounting options provide great convenience. This Tyco Electronics 15-inch monitor comes with multilingual display, wherein you can choose your preferred language. With a contrast ratio of 500:1, this Tyco Electronics touch monitor provides sharp, crisp images.\nProduct Identifiers BrandElo Model1537L UPC074114931826, 7411493104510 Additional MPNE194933, F76514-000\nKey Features Product LineElo Touch Display TechnologyLCD, TFT Screen Size15\" Maximum Resolution1024 x 768 Aspect Ratio4:3 Contrast Ratio500:1 Response Time17 ms Refresh Rate56Hz - 75Hz\nTechnical Features Synchronization Range - Vertical56.3 - 75 kHz Synchronization Range - Horizontal31.5 - 60.2 kHz Max Viewing Angle Horizontal120\u00c2\u00b0 Max Viewing Angle Vertical100\u00c2\u00b0 Regulatory ApprovalC-Tick, CE, FCC, IC, TUV-GS, UL, VCCI, cUL Color Support24-bit (16.7M Colors) Form FactorIntegrated\nConnectivity Input DeviceTouch Screen Analog Video Input Connector1 x 15 Pin D-Sub connector\nMiscellaneous Monitor ColorGray",
    "product line": "Elo Touch",
    "refresh rate": "56Hz - 75Hz",
    "regulatory approval": "C-Tick, CE, FCC, IC, TUV-GS, UL, VCCI, cUL",
    "response time": "17 ms",
    "screen size": "15\"",
    "synchronization range  horizontal": "31.5 - 60.2 kHz",
    "synchronization range  vertical": "56.3 - 75 kHz",
    "system": "Integrated",
    "upc": "074114931826, 7411493104510"
}