{
    "<page title>": "HP L1706 17\" Flat Panel LCD Computer Monitor w VGA Cable Free Shipping 829160879420 | eBay",
    "additional mpn": "PX849A8",
    "analog video input connector": "1 x 15 Pin D-Sub connector",
    "aspect ratio": "5:4",
    "brand": "HP",
    "brightness": "300 cd/m\u00c2\u00b2",
    "color support": "24-bit (16.7M Colors)",
    "contrast ratio": "500",
    "display technology": "LCD",
    "form factor": "Desktop",
    "max resolution": "1280 x 1024",
    "max viewing angle horizontal": "140\u00c2\u00b0",
    "max viewing angle vertical": "130\u00c2\u00b0",
    "maximum resolution": "1280 x 1024",
    "model": "L1706",
    "monitor color": "Black & Silver",
    "monitor platform source": "PC, Mac",
    "mpn": "PX849A8",
    "product information": "Enhance your visual experience with the 17-inch black and silver HP L1706 monitor that ensures excellent picture quality. With 500:1 (typical) contrast ratio, this HP LCD monitor produces vibrant, colorful images. Get a perfect view from any corner of your room with 140 degrees horizontal and 130 degrees vertical viewing angle of this HP monitor. To customize the picture settings, this HP LCD monitor comes with on-Screen controls like image control, brightness, contrast, etc. The 1280 x 1024 (at 60 Hz) native resolution of this HP monitor ensures crisp and clear image quality. The Energy Star Compliant HP L1706 monitor assures lesser energy consumption.\nProduct Identifiers BrandHP ModelL1706 UPC829160879420, 890552692255 Additional MPNPX849A8\nKey Features Product LineHP Compaq Display TechnologyFlat Panel LCD TFT (Active Matrix), LCD Screen Size17\" Maximum Resolution1280 x 1024 Aspect Ratio5:4 Contrast Ratio500:1 Response Time8 ms Refresh Rate60 Hz\nTechnical Features Synchronization Range - Vertical50 - 76 kHz Synchronization Range - Horizontal30 - 83 kHz Max Viewing Angle Horizontal140\u00c2\u00b0 Max Viewing Angle Vertical130\u00c2\u00b0 Regulatory ApprovalCE, Energy Star, Energy star, FCC, GOST-R, ISO 13406-2 (Pixel Defect Guidelines), ISO 13406-2 (Pixel defect guidelines), ISO 9241-3, ISO 9241-7, ISO 9241-8, MPR-, MPR-II, TCO-03, UL, VCCI Color Support24-bit (16.7M Colors) Form FactorDesktop\nConnectivity Analog Video Input Connector1 x 15 Pin D-Sub connector\nMiscellaneous Monitor ColorBlack & Silver Monitor Platform SourcePC, Mac",
    "product line": "HP Compaq",
    "refresh rate": "60 Hz",
    "regulatory approval": "CE, Energy Star, Energy star, FCC, GOST-R, ISO 13406-2 (Pixel Defect Guidelines), ISO 13406-2 (Pixel defect guidelines), ISO 9241-3, ISO 9241-7, ISO 9241-8, MPR-, MPR-II, TCO-03, UL, VCCI",
    "response time": "8 ms",
    "screen size": "17\"",
    "synchronization range  horizontal": "30 - 83 kHz",
    "synchronization range  vertical": "50 - 76 kHz",
    "system": "Desktop",
    "upc": "829160879420, 890552692255"
}