{
    "<page title>": "Samsung SyncMaster 730B 17\" LCD Monitor 729507708256 | eBay",
    "additional mpn": "730B, LS17BIBKSXSA 10208629 730B SCI730B SAM1757",
    "analog video input connector": "1 x 15 Pin D-Sub connector, 1 x 15 Pin D-Sub connector",
    "aspect ratio": "5:4",
    "brand": "Samsung",
    "brightness": "300 cd/m\u00c2\u00b2",
    "color support": "24-bit (16.7M Colors)",
    "condition": "Used: An item that has been used previously. The item may have some signs of cosmetic wear, but is fully\noperational and functions as intended. This item may be a floor model or store return that has been used. See the seller\u00e2\u0080\u0099s listing for full details and description of any imperfections.\nSee all condition definitions- opens in a new window or tab\n... Read moreabout the condition\nBrand:\nSamsung",
    "contrast ratio": "600",
    "digital video input standard": "DVI-D",
    "display technology": "LCD",
    "form factor": "Desktop",
    "max viewing angle horizontal": "160\u00c2\u00b0",
    "max viewing angle vertical": "160\u00c2\u00b0",
    "max. resolution": "1280 x 1024",
    "maximum resolution": "1280 x 1024",
    "model": "730B",
    "monitor color": "Black",
    "mpn": "LS17BIBKSXSA, 10208629, 730B, SCI730B, SAM1757",
    "product information": "Get powerful visual output with the 17-inch LCD display in the Syncmaster 730B monitor. With 1280x 1024 resolutions, this Samsung 17-inch monitor is optimum for regular office work delivering quality images. A 160\u00c2\u00b0 horizontal and vertical viewing angle in this Samsung LCD monitor gives you a comfortable viewing experience. The contrast ratio of 600:1 in this Samsung 17-inch monitor delivers crisp text and images. The Ultra-fast 8ms response time in this Samsung LCD monitor gives excellent graphics while watching movies and gaming. The exclusive MagicBright and MagicTune technology featured in the Syncmaster 730B lets you easily adjust brightness with brilliant color.\nProduct Identifiers BrandSamsung Model730B UPC729507708256, 898817001323 Additional MPN730B, LS17BIBKSXSA 10208629 730B SCI730B SAM1757\nKey Features Product LineSamsung SyncMaster Display TechnologyFlat Panel LCD TFT (Active Matrix), LCD, LCD Flat Panel LCD TFT (Active Matrix), LCD Flat Panel LCD TFT (Active Matrix) LCD Flat Panel LCD TFT (Active Matrix) Screen Size17\" Maximum Resolution1280 x 1024 Aspect Ratio5:4 Contrast Ratio600:1 Response Time8 ms Refresh Rate75 Hz\nTechnical Features Synchronization Range - Vertical56 - 75 kHz Synchronization Range - Horizontal30 - 81 kHz Max Viewing Angle Horizontal160\u00c2\u00b0 Max Viewing Angle Vertical160\u00c2\u00b0 Regulatory ApprovalFCC, MPR-, MPR-II, TCO-03, TCO-95, TCO-99 Color Support24-bit (16.7M Colors) Form FactorDesktop\nConnectivity Analog Video Input Connector1 x 15 Pin D-Sub connector, 1 x 15 Pin D-Sub connector Digital Video Input StandardDVI-D\nMiscellaneous Monitor ColorBlack",
    "product line": "Samsung SyncMaster",
    "refresh rate": "75 Hz",
    "regulatory approval": "FCC, MPR-, MPR-II, TCO-03, TCO-95, TCO-99",
    "response time": "8 ms",
    "screen size": "17\"",
    "synchronization range  horizontal": "30 - 81 kHz",
    "synchronization range  vertical": "56 - 75 kHz",
    "system": "Desktop",
    "upc": "729507708256",
    "video inputs": "DVI-D"
}