{
    "<page title>": "Acer V176L 17\" LED LCD Monitor 5 4 5 MS UM BV6AA 003 LED 1280x1024 V176L BM | eBay",
    "aspect ratio": "5:4",
    "brand": "Acer",
    "brightness": "250 Nit",
    "condition": "New: A brand-new, unused, unopened, undamaged item in its original packaging (where packaging is\napplicable). Packaging should be the same as what is found in a retail store, unless the item is handmade or was packaged by the manufacturer in non-retail packaging, such as an unprinted box or plastic bag. See the seller's listing for full details.\nSee all condition definitions- opens in a new window or tab\n... Read moreabout the condition",
    "contrast ratio": "100,000,000:1",
    "display technology": "LED LCD",
    "main features": "Manufacturer/Supplier: Acer, Inc\nManufacturer Part Number: UM.BV6AA.003\nManufacturer Website Address: http://us.acer.com\nBrand Name: Acer\nProduct Series: V\nProduct Model: V176L\nProduct Name: V176L LCD Monitor\nProduct Type: LCD Monitor\nNumber of Screens: 1\nScreen Size: 17\"\nScreen Mode: SXGA\nResponse Time: 5 ms\nAspect Ratio: 5:4\nHorizontal Viewing Angle: 170\u00c2\u00b0\nVertical Viewing Angle: 160\u00c2\u00b0\nAdjustable Display Angle: Yes\nAdjustable Display Height: No\nAdjustable Display Pivot: No\nBacklight Technology: LED\nMaximum Resolution: 1280 x 1024\nStandard Refresh Rate: 75 Hz\nColor Supported: 16.7 Million Colors\nContrast Ratio: 100,000,000:1\nBrightness: 250 Nit\nSpeakers: Yes\nVGA: Yes\nInput Voltage: 110 V AC, 220 V AC\nOperating Power Consumption: 13 W\nStandby Power Consumption: 450 mW\nOff-Mode Power Consumption: 350 mW\nColor: Black\nHeight: 12.2\"\nWidth: 14.5\"\nDepth: 2.2\"\nHeight with Stand: 15.53\"\nWidth with Stand: 14.53\"\nDepth with Stand: 7.52\"\nWeight (Approximate): 4.85 lb\nWeight with Stand (Approximate): 5.73 lb\nPackage Contents: V176L LCD Monitor, 1 x VGA Cable, Power Cord\nGreen Compliant: Yes\nGreen Compliance Certificate/Authority: EPEAT Gold, TCO Certified Displays 6.0 General Information\nManufacturer/Supplier:\nAcer, Inc\nManufacturer Part Number:\nUM.BV6AA.003\nManufacturer Website Address:\nhttp://us.acer.com\nBrand Name:\nAcer\nProduct Series:\nV\nProduct Model:\nV176L\nProduct Name:\nV176L LCD Monitor\nProduct Type:\nLCD Monitor Technical Information\nNumber of Screens:\n1\nScreen Size:\n17\"\nScreen Mode:\nSXGA\nScreen Surface:\nAnti-glare\nResponse Time:\n5 ms\nAspect Ratio:\n5:4\nHorizontal Viewing Angle:\n170\u00c2\u00b0\nVertical Viewing Angle:\n160\u00c2\u00b0\nAdjustable Display Angle:\nYes\nAdjustable Display Height:\nNo\nAdjustable Display Pivot:\nNo\nBacklight Technology:\nLED Video\nMaximum Resolution:\n1280 x 1024\nStandard Refresh Rate:\n75 Hz\nColor Supported:\n16.7 Million Colors\nContrast Ratio:\n100,000,000:1\nBrightness:\n250 Nit Audio\nSpeakers:\nYes Interfaces/Ports\nVGA:\nYes Power Description\nInput Voltage:\n220 V AC\n110 V AC\nOperating Power Consumption:\n13 W\nStandby Power Consumption:\n450 mW\nOff-Mode Power Consumption:\n350 mW Physical Characteristics\nColor:\nBlack\nHeight:\n12.2\"\nWidth:\n14.5\"\nDepth:\n2.2\"\nHeight with Stand:\n15.53\"\nWidth with Stand:\n14.53\"\nDepth with Stand:\n7.52\"\nWeight (Approximate):\n4.85 lb\nWeight with Stand (Approximate):\n5.73 lb Shipping Information\nShipping Dimensions :\n4.5\" Height x 14.6\" Width x 17.7\" Depth\nShipping Weight :\n7.55 lb Miscellaneous\nPackage Contents:\nV176L LCD Monitor\n1 x VGA Cable\nPower Cord\nGreen Compliant:\nYes\nGreen Compliance Certificate/Authority:\nEPEAT Gold\nTCO Certified Displays 6.0",
    "max resolution": "1280 x 1024",
    "model": "UM.BV6AA.003",
    "mpn": "UM.BV6AA.003",
    "response time": "5 ms",
    "screen size": "17\""
}