{
    "<page title>": "Samsung 225BW 22\" Widescreen LCD Monitor 1010092768 | eBay",
    "additional mpn": "225BW, LS22DPWCBQ/XAA, LS22DPWCSS/EDC, LS22DPWCSSEDC",
    "analog video input connector": "1 x 15 Pin D-Sub connector",
    "aspect ratio": "16:10",
    "brand": "Samsung",
    "brightness": "280 cd/m\u00c2\u00b2",
    "color support": "16-bit (64K Colors), 24-bit (16.7M Colors)",
    "condition": "Used: An item that has been used previously. The item may have some signs of cosmetic wear, but is fully\noperational and functions as intended. This item may be a floor model or store return that has been used. See the seller\u00e2\u0080\u0099s listing for full details and description of any imperfections.\nSee all condition definitions- opens in a new window or tab\n... Read moreabout the condition\nBrand:\nSamsung",
    "contrast ratio": "700:1,600:1",
    "depth": "2.6 in.",
    "digital video input standard": "DVI-D, Dual DVI-D",
    "display technology": "LCD",
    "form factor": "Desktop",
    "max viewing angle horizontal": "160\u00c2\u00b0",
    "max viewing angle vertical": "160\u00c2\u00b0",
    "maximum resolution": "1680 x 1050",
    "model": "SM225BW",
    "monitor color": "Black",
    "product information": "The Samsung 225BW has a 22 inch LCD TFT display, which offers you an excellent viewing experience. The 5 ms response time of this Samsung flat panel monitor offers crisp picture along with reducing blurring of images. Wide viewing angles in this Samsung 22 inch ensures that you can see all of the screen. This Samsung 22 inch offers 16.7 million colors, so you can enjoy clear and bright images. Magic Tune software in the Samsung 225BW allows you to control every on screen display (OSD) with the mouse. To provide you with an optimal viewing experience, this Samsung flat panel monitor is capable of handling both analog video signals and digital video signals.\nProduct Identifiers BrandSamsung ModelSM225BW UPC1010092768, 729507700281 Additional MPN225BW, LS22DPWCBQ/XAA, LS22DPWCSS/EDC, LS22DPWCSSEDC\nKey Features Product LineSamsung SyncMaster Display TechnologyFlat Panel LCD TFT (Active Matrix), LCD, LCD Flat Panel LCD TFT (Active Matrix) Screen Size22\" Maximum Resolution1680 x 1050 Aspect Ratio16:10 Contrast Ratio700:1,600:1 Response Time5 ms Refresh Rate75 Hz\nTechnical Features Synchronization Range - Vertical56 - 75 kHz Synchronization Range - Horizontal30 - 81 kHz Max Viewing Angle Horizontal160\u00c2\u00b0 Max Viewing Angle Vertical160\u00c2\u00b0 Regulatory ApprovalTCO-03 Color Support16-bit (64K Colors), 24-bit (16.7M Colors) Form FactorDesktop\nConnectivity Analog Video Input Connector1 x 15 Pin D-Sub connector Digital Video Input StandardDVI-D, Dual DVI-D\nDimensions Width19.9 in. Depth2.6 in. Weight15.2 lb.\nMiscellaneous Monitor ColorBlack Release DateAugust, 2006",
    "product line": "Samsung SyncMaster",
    "refresh rate": "75 Hz",
    "regulatory approval": "TCO-03",
    "release date": "August, 2006",
    "response time": "5 ms",
    "screen size": "22\"",
    "synchronization range  horizontal": "30 - 81 kHz",
    "synchronization range  vertical": "56 - 75 kHz",
    "system": "Desktop",
    "upc": "1010092768, 729507700281",
    "video inputs": "DVI-D, Dual DVI-D",
    "weight": "15.2 lb.",
    "width": "19.9 in."
}