{
    "<page title>": "New Acer America Corp UM WV6AA A01 22\" 1920x1080 VA LED 886541985941 | eBay",
    "additional mpn": "UM.WV6AA.A01",
    "aspect ratio": "16:9",
    "brand": "Acer",
    "condition": "New: A brand-new, unused, unopened, undamaged item in its original packaging (where packaging is\napplicable). Packaging should be the same as what is found in a retail store, unless the item is handmade or was packaged by the manufacturer in non-retail packaging, such as an unprinted box or plastic bag. See the seller's listing for full details.\nSee all condition definitions- opens in a new window or tab\n... Read moreabout the condition\nBrand:\nAcer",
    "contrast ratio": "100000000",
    "display technology": "LED LCD",
    "max resolution": "1920 x 1080",
    "maximum resolution": "1920 x 1080",
    "model": "V226HQL",
    "mpn": "UM.WV6AA.A01",
    "product information": "LED monitor - 21.5 - 1920 x 1080 FullHD - 250 cd/m2 - 100000000:1 (dynamic) - 8 ms - DVI, VGA - black Essential Series monitors feature Acer eColor technology for striking visuals, and Acer ComfyView innovations that reduce glare to deliver most-comfortable viewing. These sturdy monitors also have a wide array of ports, so you can connect many types of devices and do more at once. In addition, they utilize eco-friendly features to save power and money. Display Type - LED-backlit LCD monitor / TFT active matrixDiagonal Size - 21.5Aspect Ratio - WidescreenNative Resolution - FullHD 1920 x 1080Brightness - 250 cd/m2Contrast Ratio - 100000000:1 (dynamic)Color Support - 16.7 million colorsResponse Time - 8 msHorizontal Viewing Angle - 178Vertical Viewing Angle - 178Backlight Technology - LED backlightColor - BlackDimensions (WxDxH) - 20 in x 8.1 in x 15.4 in - with standWeight - 8.1 lbsInterfaces - VGA DVI ( HDCP )Display Position Adjustments - TiltFlat Panel Mount Interface - 100 x 100 mmCompliant Standards - TCO '06Dimensions & Weight Details - Without stand - weight: 7.\nProduct Identifiers BrandAcer ModelV226HQL UPC886541985941 Additional MPNUM.WV6AA.A01\nKey Features Product LineAcer V Display TechnologyLED LCD Maximum Resolution1920 x 1080 Aspect Ratio16:9 Contrast Ratio100000000:1",
    "product line": "Acer V",
    "upc": "886541985941"
}