{
    "<page title>": "Free Shipping Samsung 204B 20\" LCD Flat Panel Monitor Cables 00729507709789 | eBay",
    "additional mpn": "204BSL, LS20BRDBSQ",
    "analog video input connector": "1 x 15 Pin D-Sub connector",
    "aspect ratio": "4:3",
    "brand": "Samsung",
    "brightness": "300 cd/m\u00c2\u00b2",
    "color support": "24-bit (16.7M Colors)",
    "contrast ratio": "800",
    "digital video input standard": "DVI-D",
    "display technology": "LCD",
    "form factor": "Desktop",
    "max resolution": "1600 x 1200",
    "max viewing angle horizontal": "160\u00c2\u00b0",
    "max viewing angle vertical": "160\u00c2\u00b0",
    "maximum resolution": "1600 x 1200",
    "model": "204B",
    "monitor color": "Black & Silver",
    "monitor platform source": "PC, PC, Mac",
    "mpn": "LS20BRDBSQ",
    "product information": "Have a wonderful viewing experience on the black and silver SyncMaster 204B monitor that features a wider viewing angle of 160 degrees. This Samsung LCD monitor features a contrast ratio of 800:1 for crisp and vibrant images. The MagicColor feature of this 20-inch monitor delivers improved hue and saturation of colors. The 8ms MagicSpeed of the SyncMaster 204B monitor delivers fast moving action scenes clearly without judder. The dual interface of this Samsung LCD monitor processes both analog and digital video signals for an optimal viewing experience. The MagicBright feature of this 20-inch monitor offers four different modes namely text, internet, entertain and custom with its own pre-configured brightness value. Owing to the MagicTune feature, the SyncMaster 204B monitor delivers an enhanced OSD GUI interface that makes it easier for you to understand and operate.\nProduct Identifiers BrandSamsung Model204B UPC00729507709789, 729507709789, 8808979870912 Additional MPN204BSL, LS20BRDBSQ\nKey Features Product LineSamsung SyncMaster Display TechnologyFlat Panel LCD TFT (Active Matrix), LCD, LCD Flat Panel LCD TFT (Active Matrix) Screen Size20.1\" Maximum Resolution1600 x 1200 Aspect Ratio4:3 Contrast Ratio800:1 Response Time5 ms Refresh Rate75 Hz\nTechnical Features Synchronization Range - Vertical56 - 75 kHz Synchronization Range - Horizontal30 - 81 kHz Max Viewing Angle Horizontal160\u00c2\u00b0 Max Viewing Angle Vertical160\u00c2\u00b0 Regulatory ApprovalEnergy star, TCO-99 Color Support24-bit (16.7M Colors) Form FactorDesktop\nConnectivity Analog Video Input Connector1 x 15 Pin D-Sub connector Digital Video Input StandardDVI-D\nMiscellaneous Monitor ColorBlack & Silver Monitor Platform SourcePC, PC, Mac",
    "product line": "Samsung SyncMaster",
    "refresh rate": "75 Hz",
    "regulatory approval": "Energy star, TCO-99",
    "response time": "5 ms",
    "screen size": "20.1\"",
    "synchronization range  horizontal": "30 - 81 kHz",
    "synchronization range  vertical": "56 - 75 kHz",
    "system": "Desktop",
    "upc": "00729507709789, 729507709789, 8808979870912",
    "video inputs": "DVI-D"
}