{
    "<page title>": "NEC MultiSync LCD1770VX 17 inch LCD Monitor 805736013481 | eBay",
    "additional mpn": "LCD1770VXBKFT",
    "analog video input connector": "1 x 15 Pin D-Sub connector",
    "aspect ratio": "5:4",
    "brand": "NEC",
    "color support": "24-bit (16.7M Colors)",
    "contrast ratio": "600:1,500:1",
    "depth": "8 in.",
    "digital video input standard": "DVI-D",
    "display technology": "Flat Panel LCD TFT (Active Matrix), LCD, LCD Flat Panel LCD TFT (Active Matrix)",
    "features": "none",
    "form factor": "Desktop",
    "max resolution": "1280 x 1024",
    "max viewing angle horizontal": "160\u00c2\u00b0",
    "max viewing angle vertical": "160\u00c2\u00b0",
    "maximum resolution": "1280 x 1024",
    "model": "LCD1770VX",
    "monitor color": "Black",
    "monitor platform source": "PC",
    "product information": "This 17-inch NEC MultiSync monitor is modern, full-featured, and created for people who want to improve their computer systems. Bloggers and computer novices can take pleasure in the capabilities, reliability, and design of this NEC MultiSync monitor. The NEC LCD1770VX is a good device for multiplying your gameplay thanks to the better color balance. As this LCD monitor comes with a great 1280 x 1024 screen resolution, you can benefit from sharper email messages, video games, and office documents. The NEC LCD1770VX helps you to appreciate the wonderful picture quality and work more effectively with its clear advanced image technology. With the easy-to-master controls found on this NEC MultiSync monitor, you can tweak the screen settings to your liking to optimize your reading proficiency or movie enjoyment. Be the envy of your friends with this LCD monitor and its sleek black body. Also, with the excellent moderate-sized display found on the NEC LCD1770VX, you can delight in enhanced computing productivity.\nProduct Identifiers BrandNEC ModelLCD1770VX UPC805736013481, 805736018301 Additional MPNLCD1770VXBKFT\nKey Features Product LineNEC MultiSync Display TechnologyFlat Panel LCD TFT (Active Matrix), LCD, LCD Flat Panel LCD TFT (Active Matrix) Screen Size17\" Maximum Resolution1280 x 1024 Aspect Ratio5:4 Contrast Ratio600:1,500:1 Response Time12 ms\nTechnical Features Synchronization Range - Vertical0 - 0 kHz Synchronization Range - Horizontal32 - 81 kHz Max Viewing Angle Horizontal160\u00c2\u00b0 Max Viewing Angle Vertical160\u00c2\u00b0 Regulatory ApprovalISO 13406-2 (Pixel Defect Guidelines) Color Support24-bit (16.7M Colors) Form FactorDesktop\nConnectivity Analog Video Input Connector1 x 15 Pin D-Sub connector Digital Video Input StandardDVI-D\nDimensions Depth8 in.\nMiscellaneous Monitor ColorBlack Monitor Platform SourcePC",
    "product line": "NEC MultiSync",
    "regulatory approval": "ISO 13406-2 (Pixel Defect Guidelines)",
    "response time": "12 ms",
    "screen size": "17\"",
    "synchronization range  horizontal": "32 - 81 kHz",
    "synchronization range  vertical": "0 - 0 kHz",
    "upc": "805736013481, 805736018301",
    "video inputs": "VGA, DVI"
}