{
    "<page title>": "HP Pavilion F2105 21\" Widescreen LCD Monitor Built in Speakers Keyboard Mouse 829160829180 | eBay",
    "additional mpn": "P8727AA F2105",
    "analog video input connector": "1 x 15 Pin D-Sub connector",
    "aspect ratio": "16:9, 16:10, 14:9",
    "audio input": "RCA",
    "brand": "HP",
    "brightness": "300 cd/m\u00c2\u00b2",
    "color support": "24-bit (16.7M Colors)",
    "contrast ratio": "1000:1,900:1",
    "digital video input standard": "DVI-D",
    "display technology": "Flat Panel LCD TFT (Active Matrix), LCD",
    "features": "Built-In Speakers",
    "form factor": "Desktop",
    "max resolution": "1680 x 1050",
    "max viewing angle horizontal": "178\u00c2\u00b0",
    "max viewing angle vertical": "178\u00c2\u00b0",
    "maximum resolution": "1680 x 1050",
    "model": "F2105",
    "monitor color": "Silver",
    "monitor platform source": "PC",
    "mpn": "P8727AA, F2105",
    "product information": "With an images aspect ratio of 16:10, the HP f2105 provides enhanced viewing area for enjoying HD content. This HP 21-inch monitor features a brightness of 300.0 cd/m2 and 900:1 contrast ratio for more sharp, vivid and lively pictures. The maximum resolution of 1680 x 1050 in this HP LCD monitor produces excellent quality images. The 16 ms response time in this HP 21-inch monitor produces flawless image transitions while viewing 3D images or playing games. The maximum viewing angle of 178 degrees vertical and horizontal both in this HP LCD monitor gives clear visibility from almost any side. The HP f2105 is energy efficient with a power consumption of 90.0 Watt in operating and 2.0 Watt standby mode.\nProduct Identifiers BrandHP ModelF2105 UPC829160829180 Additional MPNP8727AA F2105\nKey Features Product LineHP Pavilion Display TechnologyFlat Panel LCD TFT (Active Matrix), LCD Screen Size21\" Maximum Resolution1680 x 1050 Aspect Ratio14:9, 16:10, 16:9 Contrast Ratio1000:1,900:1 Response Time16 ms\nTechnical Features Synchronization Range - Vertical48 - 85 kHz Synchronization Range - Horizontal30 - 94 kHz Max Viewing Angle Horizontal178\u00c2\u00b0 Max Viewing Angle Vertical178\u00c2\u00b0 Regulatory ApprovalCCC, CE, CSA, FCC, ISO 13406-2 (Pixel Defect Guidelines), ISO 13406-2 (Pixel defect guidelines), MPR-, NOM, TCO-03, TCO-99, TUV GS, TUV-GS, UL, WHQL, cUL Color Support24-bit (16.7M Colors) Form FactorDesktop\nConnectivity Audio InputRCA Analog Video Input Connector1 x 15 Pin D-Sub connector Digital Video Input StandardDVI-D\nMiscellaneous Monitor ColorSilver Monitor Platform SourcePC",
    "product line": "HP Pavilion",
    "regulatory approval": "CCC, CE, CSA, FCC, ISO 13406-2 (Pixel Defect Guidelines), ISO 13406-2 (Pixel defect guidelines), MPR-, NOM, TCO-03, TCO-99, TUV GS, TUV-GS, UL, WHQL, cUL",
    "response time": "16 ms",
    "screen size": "21\"",
    "synchronization range  horizontal": "30 - 94 kHz",
    "synchronization range  vertical": "48 - 85 kHz",
    "system": "Desktop",
    "upc": "829160829180"
}