{
    "<page title>": "BenQ VW2430H 24\" LED LCD Monitor 16 9 4 MS 840046025533 | eBay",
    "aspect ratio": "16:9",
    "brand": "BenQ",
    "brightness": "250 Nit",
    "condition": "New: A brand-new, unused, unopened, undamaged item in its original packaging (where packaging is\napplicable). Packaging should be the same as what is found in a retail store, unless the item is handmade or was packaged by the manufacturer in non-retail packaging, such as an unprinted box or plastic bag. See the seller's listing for full details.\nSee all condition definitions- opens in a new window or tab\n... Read moreabout the condition",
    "contrast ratio": "3,000:1",
    "display technology": "LCD",
    "main features": "Limited Warranty: 3 YearManufacturer/Supplier: BenQ CorporationManufacturer Part Number: VW2430HManufacturer Website Address: http://www.benq.comBrand Name: BenQProduct Series: VWProduct Model: VW2430HProduct Name: VW2430H Widescreen LCD MonitorMarketing Information: No Printing, No Coating,Just Expressly Beautiful!BenQ VW2430H embodies simple living with eco-friendly sophistication while keeping things interesting with its clean, curvy lines, unconventional asymmetric form and a uniquely designed docking accessory that serves as a holder for your mobile phone and cards.Product Type: LCD MonitorNumber of Screens: 1Screen Size: 24\"Screen Mode: Full HDResponse Time: 4 msAspect Ratio: 16:9Horizontal Viewing Angle: 178\u00c2\u00b0Vertical Viewing Angle: 178\u00c2\u00b0Adjustable Display Angle: YesAdjustable Display Height: NoMount Type: Wall MountableBacklight Technology: LEDHDCP Supported: YesFeatures: Security Lock, Senseye 3, Eco ModeMaximum Resolution: 1920 x 1080Color Supported: 16.7 Million ColorsContrast Ratio: 3,000:1Brightness: 250 NitSpeakers: NoDVI: YesHDMI: YesVGA: YesInput Voltage: 110 V AC, 220 V ACOperating Power Consumption: 40 WStandby Power Consumption: 300 mWVESA Mount Compatible: YesVESA Mount Standard: 100 x 100Color: WhiteHeight: 16.8\"Width: 22.3\"Depth: 7.5\"Weight (Approximate): 9.92 lbPlatform Supported: PC, MacGreen Compliant: YesGreen Compliance Certificate/Authority: TCO Certified Displays 6.0 General Information Manufacturer/Supplier:BenQ CorporationManufacturer Part Number:VW2430HManufacturer Website Address:http://www.benq.comBrand Name:BenQProduct Series:VWProduct Model:VW2430HProduct Name:VW2430H Widescreen LCD MonitorMarketing Information:No Printing, No Coating,\nJust Expressly Beautiful!BenQ VW2430H embodies simple living with eco-friendly sophistication while keeping things interesting with its clean, curvy lines, unconventional asymmetric form and a uniquely designed docking accessory that serves as a holder for your mobile phone and cards.Product Type:LCD Monitor Technical Information Number of Screens:1Screen Size:24\"Screen Mode:Full HDResponse Time:4 msAspect Ratio:16:9Horizontal Viewing Angle:178\u00c2\u00b0Vertical Viewing Angle:178\u00c2\u00b0Adjustable Display Angle:YesAdjustable Display Height:NoMount Type:Wall MountableBacklight Technology:LEDHDCP Supported:YesFeatures:Security LockSenseye 3Eco Mode Video Maximum Resolution:1920 x 1080Color Supported:16.7 Million ColorsContrast Ratio:3,000:1Brightness:250 Nit Audio Speakers:No Interfaces/Ports DVI:YesHDMI:YesVGA:YesHeadphone:Yes Power Description Input Voltage:110 V AC220 V ACOperating Power Consumption:40 WStandby Power Consumption:300 mW Physical Characteristics VESA Mount Compatible:YesVESA Mount Standard:100 x 100Color:WhiteHeight:16.8\"Width:22.3\"Depth:7.5\"Weight (Approximate):9.92 lb Shipping Information Shipping Dimensions :5.0\" Height x 16.5\" Width x 25.5\" DepthShipping Weight :13.0 lb Miscellaneous Platform Supported:PCMacGreen Compliant:YesGreen Compliance Certificate/Authority:TCO Certified Displays 6.0 Warranty Limited Warranty:3 Year",
    "max resolution": "1920 x 1080",
    "model": "VW2430H",
    "mpn": "VW2430H",
    "response time": "4 ms",
    "screen size": "24\""
}