{
    "<page title>": "Samsung SyncMaster 940BW 19\" Widescreen LCD Monitor 729507708638 | eBay",
    "additional mpn": "LS19HAWCSQEDC, LS19HAWKBY/XAA",
    "analog video input connector": "1 x 15 Pin D-Sub connector",
    "aspect ratio": "16:10",
    "brand": "Samsung",
    "brightness": "300 cd/m\u00c2\u00b2",
    "color support": "24-bit (16.7M Colors)",
    "contrast ratio": "500:1",
    "digital video input standard": "DVI-D",
    "display technology": "Flat Panel LCD TFT (Active Matrix), LCD, LCD Flat Panel LCD TFT (Active Matrix), LCD Flat Panel LCD TFT (Active Matrix) LCD Flat Panel LCD TFT (Active Matrix)",
    "form factor": "Desktop",
    "max viewing angle horizontal": "160\u00c2\u00b0",
    "max viewing angle vertical": "160\u00c2\u00b0",
    "model": "940BW",
    "monitor color": "Black",
    "mpn": "LS19HAWKBY/XAA",
    "product information": "Get the best and rich colors picture quality with the Samsung Syncmaster 940BW monitor has it has MagicColor Engine. Integrated with Intelligent Mode, this Samsung 19-inch monitor enhances the color tone except skin colors whose changes are easily distinguished. With Full Color Enhancement, this Samsung LCD monitor helps to improve the picture skin quality, the hue and saturation of full screen to convey clear and lively colors of the images. This Samsung LCD monitor also lets you have regular internet connection settings to access the web easily. The Samsung Syncmaster 940BW has an easy control mouse (OSD) which lets you operate the functions comfortably through it. Powered by 1440x900p resolution, this Samsung 19-inch monitor delivers amazing image output.\nProduct Identifiers BrandSamsung Model940BW UPC729507708638, 8808979504732 Additional MPNLS19HAWCSQEDC, LS19HAWKBY/XAA\nKey Features Product LineSamsung SyncMaster Display TechnologyFlat Panel LCD TFT (Active Matrix), LCD, LCD Flat Panel LCD TFT (Active Matrix), LCD Flat Panel LCD TFT (Active Matrix) LCD Flat Panel LCD TFT (Active Matrix) Screen Size19\" Aspect Ratio16:10 Contrast Ratio500:1 Response Time4 ms Refresh Rate75 Hz\nTechnical Features Synchronization Range - Vertical56 - 75 kHz Synchronization Range - Horizontal30 - 81 kHz Max Viewing Angle Horizontal160\u00c2\u00b0 Max Viewing Angle Vertical160\u00c2\u00b0 Regulatory ApprovalTCO-03 Color Support24-bit (16.7M Colors) Form FactorDesktop\nConnectivity Analog Video Input Connector1 x 15 Pin D-Sub connector Digital Video Input StandardDVI-D\nMiscellaneous Monitor ColorBlack Release DateAugust",
    "product line": "Samsung SyncMaster",
    "refresh rate": "75 Hz",
    "regulatory approval": "TCO-03",
    "release date": "August",
    "response time": "4 ms",
    "screen size": "19\"",
    "synchronization range  horizontal": "30 - 81 kHz",
    "synchronization range  vertical": "56 - 75 kHz",
    "upc": "729507708638, 8808979504732"
}