{
    "<page title>": "HP Pavilion W2408 24\" LCD Monitor with Built in Speakers 808736978651 | eBay",
    "additional mpn": "W2408",
    "analog video input connector": "1 x 15 Pin D-Sub connector",
    "brand": "HP",
    "brightness": "400 cd/m\u00c2\u00b2",
    "color support": "24-bit (16.7M Colors)",
    "contrast ratio": "1000:1",
    "digital video input standard": "DVI-D",
    "display technology": "LCD",
    "features": "Built-In Speakers",
    "form factor": "Desktop",
    "max resolution": "1920 x 1200",
    "max viewing angle horizontal": "160\u00c2\u00b0",
    "max viewing angle vertical": "160\u00c2\u00b0",
    "maximum resolution": "1920 x 1200",
    "model": "W2408",
    "monitor color": "Black",
    "mpn": "RY117AA#ABB",
    "product information": "Having a high resolution of 1920x1200, the HP Pavilion W2408 gives you sharp and clear picture quality. With the contrast ratio of 1,000:1, this HP 24-inch LCD makes picture color more vibrant. BriteView Technology offers 400 cd/m\u00c3\u0082\u00c2\u00b2 nits to the screen that enhances picture quality of this HP monitor in any lighting condition. Offering a fast response of 5 ms the HP Pavilion W2408 adds life to your gaming experience. Featuring aspect ratio of 16:10, this HP 24-inch LCD gives you comfortable viewing experience. You can make adjustment in HP monitor \u00c3\u0082\u00e2\u0080\u0093 tilt, height and pivot for comfortable viewing.\nProduct Identifiers BrandHP ModelW2408 UPC808736978651 Additional MPNW2408\nKey Features Product LineHP Pavilion Display TechnologyFlat Panel LCD TFT (Active Matrix), LCD Screen Size24\" Maximum Resolution1920 x 1200 Contrast Ratio1000:1 Response Time5 ms Refresh Rate60 Hz\nTechnical Features Synchronization Range - Vertical48 - 85 kHz Synchronization Range - Horizontal24 - 94 kHz Max Viewing Angle Horizontal160\u00c2\u00b0 Max Viewing Angle Vertical160\u00c2\u00b0 Regulatory ApprovalCE, CISPR, Energy Star, Energy star, FCC, GOST, ISO 13406-2 (Pixel Defect Guidelines), ISO 13406-2 (Pixel defect guidelines), ISO 9241-3, ISO 9241-7, ISO 9241-8, MPR-, SASO, SEMKO, UL Color Support24-bit (16.7M Colors) Form FactorDesktop\nConnectivity Analog Video Input Connector1 x 15 Pin D-Sub connector Digital Video Input StandardDVI-D\nMiscellaneous Monitor ColorBlack",
    "product line": "HP Pavilion",
    "refresh rate": "60 Hz",
    "regulatory approval": "CE, CISPR, Energy Star, Energy star, FCC, GOST, ISO 13406-2 (Pixel Defect Guidelines), ISO 13406-2 (Pixel defect guidelines), ISO 9241-3, ISO 9241-7, ISO 9241-8, MPR-, SASO, SEMKO, UL",
    "response time": "5 ms",
    "screen size": "24\"",
    "synchronization range  horizontal": "24 - 94 kHz",
    "synchronization range  vertical": "48 - 85 kHz",
    "upc": "808736978651",
    "video inputs": "DVI-D"
}