{
    "<page title>": "Acer H203H 20\" Widescreen LCD Monitor w Power Cord No Stand 0846154052546 | eBay",
    "additional mpn": "H203HBBMD",
    "analog video input connector": "1 x 15 Pin D-Sub connector",
    "aspect ratio": "16:9",
    "brand": "Acer",
    "color support": "24-bit (16.7M Colors)",
    "contrast ratio": "1000",
    "digital video input standard": "DVI-D",
    "display technology": "LCD, Widescreen LCD",
    "form factor": "Desktop",
    "max resolution": "1600 x 900",
    "max viewing angle horizontal": "160\u00c2\u00b0",
    "max viewing angle vertical": "160\u00c2\u00b0",
    "maximum resolution": "1600 x 900",
    "model": "H203H",
    "monitor color": "Black",
    "mpn": "H203HBBMD",
    "product information": "Stylish and elegant, the Acer H203H is a 20-inch monitor with 1600x900 pixels resolution, allowing you to view movies and videos in HD. You can tilt your Acer H203H up or down, enabling a comfortable viewing experience. This 20-inch monitor has integrated speakers that offer a complete audio experience. Using DVI-D ports, you can easily connect this Acer LCD monitor to your desktops, laptops, and game consoles. This Acer LCD monitor is environment-friendly, as it avoids the use of toxic and hazardous chemicals. Being VESA-compatible, you can easily mount the Acer H203H on a VESA stand.\nProduct Identifiers BrandAcer ModelH203H UPC0846154052546, 099802534837 Additional MPNH203HBBMD\nKey Features Display TechnologyLCD, Widescreen LCD Screen Size20\" Maximum Resolution1600 x 900 Aspect Ratio16:9 Contrast Ratio1000:1, 1000:1 Response Time5 ms Refresh Rate60 Hz\nTechnical Features Synchronization Range - Vertical55 - 75 kHz Synchronization Range - Horizontal30 - 80 kHz Max Viewing Angle Horizontal160\u00c2\u00b0 Max Viewing Angle Vertical160\u00c2\u00b0 Regulatory ApprovalCE, Energy Star, Energy star, FCC, NOM, RoHS, TCO-03, TUV GS, TUV-GS, VCCI, cUL Color Support24-bit (16.7M Colors) Form FactorDesktop\nConnectivity Analog Video Input Connector1 x 15 Pin D-Sub connector Digital Video Input StandardDVI-D\nMiscellaneous Monitor ColorBlack",
    "refresh rate": "60 Hz",
    "regulatory approval": "CE, Energy Star, Energy star, FCC, NOM, RoHS, TCO-03, TUV GS, TUV-GS, VCCI, cUL",
    "response time": "5 ms",
    "screen size": "20\"",
    "synchronization range  horizontal": "30 - 80 kHz",
    "synchronization range  vertical": "55 - 75 kHz",
    "system": "Desktop",
    "upc": "0846154052546, 099802534837",
    "video inputs": "DVI-D"
}