{
    "<page title>": "Dell UltraSharp 1907FP 19\" LCD Monitor 890552699452 | eBay",
    "additional mpn": "C553H, CC299, CC388, CJ319, DC323, GC578",
    "analog video input connector": "1 x 15 Pin D-Sub connector",
    "aspect ratio": "5:4",
    "brand": "Dell",
    "brightness": "300 cd/m\u00c2\u00b2",
    "color support": "24-bit (16.7M Colors)",
    "contrast ratio": "700:1",
    "digital video input standard": "DVI-D",
    "display technology": "LCD",
    "form factor": "Desktop",
    "max resolution": "1280 x 1024",
    "max viewing angle horizontal": "140\u00c2\u00b0",
    "max viewing angle vertical": "130\u00c2\u00b0",
    "maximum resolution": "1280 x 1024",
    "model": "1907FP",
    "monitor color": "Black",
    "mpn": "DC323",
    "product information": "Thanks to its high 1280x1024-pixel resolution, the 19-inch black Dell UltraSharp 1907FP LCD monitor produces your pictures, videos, and text documents, with optimum detail and clarity. The response time of 8 ms in this Dell LCD monitor ensures faster image transitions, during sports shows, games, 3D movies, etc. Boasting a viewing angle of 130 degrees vertical and 140 degrees horizontal, this Dell monitor provides a crisp and clear view from almost any side. Equipped with five USB 2.0 high speed ports, this Dell LCD monitor offers quick and hassle-free connectivity with the desktop peripherals. Designed with a slim and lightweight profile, this Dell monitor saves a lot of your desk space. So, get the UltraSharp 1907FP home, or to your workplace, and increase your productivity, appreciably\nProduct Identifiers BrandDell Model1907FP UPC890552699452 Additional MPNC553H, CC299, CC388, CJ319, DC323, GC578\nKey Features Product LineDell UltraSharp Display TechnologyLCD Screen Size19\" Maximum Resolution1280 x 1024 Aspect Ratio5:4 Contrast Ratio700:1 Response Time8 ms Refresh Rate75 Hz\nTechnical Features Synchronization Range - Vertical56 - 75 kHz Synchronization Range - Horizontal30 - 81 kHz Max Viewing Angle Horizontal140\u00c2\u00b0 Max Viewing Angle Vertical130\u00c2\u00b0 Color Support24-bit (16.7M Colors) Form FactorDesktop\nConnectivity Analog Video Input Connector1 x 15 Pin D-Sub connector Digital Video Input StandardDVI-D\nMiscellaneous Monitor ColorBlack",
    "product line": "Dell UltraSharp",
    "refresh rate": "75 Hz",
    "response time": "8 ms",
    "screen size": "19",
    "synchronization range  horizontal": "30 - 81 kHz",
    "synchronization range  vertical": "56 - 75 kHz",
    "upc": "890552699452",
    "video inputs": "DVI-D"
}